{
  "capabilityId": "synthetic-change-summary",
  "decision": "approval-required",
  "rationale": "Synthetic capability requires human review before broader availability.",
  "reviewerRole": "platform-governance-reviewer",
  "decidedAt": "2026-07-11T00:00:00.000Z",
  "reviewBy": "2026-08-11T00:00:00.000Z",
  "evidenceReferences": ["https://example.com/cloudai-platform/change-summary/evidence"]
}
